{
  "schema_version": "kcp/0.1",
  "logical_id": "kc://marketing/incrementality/paid-search-lift-q1-2026",
  "version": "1.0.0",
  "capsule_type": "metric",
  "statement": "Paid search campaigns produced an estimated 6-9% incremental lift in conversions during Q1 2026, based on a geo-holdout experiment.",
  "epistemic_status": "estimated",
  "confidence": {
    "basis": "statistical_inference",
    "ceiling": 0.6,
    "rationale": "Single geo-holdout experiment with a 12-market sample; not yet replicated. Ceiling capped below 'established' pending replication."
  },
  "lifecycle_state": "published",
  "evidence": [
    {
      "source_id": "geo-holdout-report-2026-q1",
      "span": "results, table 3",
      "excerpt": "Estimated incremental lift: 6-9% (95% CI), 12 matched market pairs, 8-week holdout.",
      "authority": "primary",
      "retrieved_at": "2026-04-02T12:00:00Z"
    }
  ],
  "applicability": {
    "jurisdictions": [],
    "valid_from": "2026-01-01",
    "valid_until": "2026-03-31",
    "conditions": [
      "applies to the paid search channel only"
    ],
    "exclusions": [
      "not validated for other channels or subsequent quarters"
    ]
  },
  "contradictions": [],
  "dependencies": [],
  "governance": {
    "owner": "growth-analytics",
    "domain": "marketing",
    "permissions": []
  },
  "evaluation_contract": {
    "mandatory_qualifications": [
      "estimated",
      "single experiment, not yet replicated"
    ],
    "prohibited_overclaims": [
      "paid search causes a 6-9% lift as an established fact",
      "this lift generalizes to other channels or quarters"
    ],
    "evaluation_rules": [
      "answers must not convert 'estimated lift' into a certain causal claim",
      "answers must not extend the Q1 2026 estimate to other periods without a new capsule"
    ]
  }
}
